{"record_kind":"elementor_project_availability_evidence","schema_version":"0.5.0","evidence_id":"elementor-availability-fixture-schema-valid","collection_status":{"status":"provided_schema_valid","reason":"Fixture demonstrates schema-valid package shape only."},"editor_v4_status":{"status":"provided_schema_valid","details":"Fixture status only."},"elementor_version_status":{"status":"provided_schema_valid","details":"Fixture status only."},"elementor_pro_status":{"status":"provided_schema_valid","details":"Fixture status only."},"atomic_elements_status":{"status":"provided_schema_valid","details":"Fixture status only."},"class_permissions_status":{"status":"provided_schema_valid","details":"Fixture status only."},"variables_status":{"status":"provided_schema_valid","details":"Fixture status only."},"components_status":{"status":"provided_schema_valid","details":"Fixture status only."},"interactions_status":{"status":"provided_schema_valid","details":"Fixture status only."},"dynamic_tags_status":{"status":"provided_schema_valid","details":"Fixture status only."},"source_ref":{"source_kind":"fixture_sample","source_id":"fixture:elementor-availability-schema-valid","observed_at":"2026-07-08T00:00:00Z"},"limitations":["Schema-valid fixture only; not collected from a real project."],"not_proven_by_evidence":["production_ready","builder_executed","downstream_contract_enforced","official_docs_fully_covered","cross_repo_integrated","project_gate_integrated","runtime_validated"]}
